{
  "version": 1,
  "updated_on": "2026-10-24",
  "timezone": "Asia/Singapore",
  "history": {
    "complete": false,
    "reviewed_reports": [
      "2026-10-18-revised",
      "2026-10-19",
      "2026-10-20",
      "https://pbhat89.github.io/the-brief/podcast/reports/2026-10-23.html"
    ],
    "gaps": [
      "Earlier public archive and private podcast history have not been fully imported into this concept log.",
      "Candidate status means researched, not proven unseen. Check all available history before selection.",
      "The AI Transformation Playbook candidate has an earlier coverage reference that still needs exact lesson-level reconciliation; pending_full_history is a reuse block, not evidence that it is unused."
    ]
  },
  "entries": [
    {
      "concept_id": "inspect-real-input-data",
      "aliases": [
        "inspect examples before modeling",
        "input data quality before architecture"
      ],
      "experts": [
        "Andrej Karpathy"
      ],
      "theme": "technical_coding",
      "title": "Inspect the data before changing the model",
      "sources": [
        {
          "title": "A Recipe for Training Neural Networks",
          "url": "https://karpathy.github.io/2019/04/25/recipe/",
          "authors": [
            "Andrej Karpathy"
          ],
          "original_date": "2019-04-25",
          "original_date_basis": "Date displayed on original publisher page",
          "checked_on": "2026-10-20",
          "kind": "first_party",
          "verification": "direct_primary",
          "locator": "The recipe, section 1: Become one with the data"
        }
      ],
      "classification": "evergreen",
      "takeaway": "Karpathy recommends examining real examples, distributions and outliers before building a model; duplicate or corrupted inputs can explain failures.",
      "editorial_application": "For an AI coding project, inspect representative inputs and failure cases before changing prompts or architecture. This is an editorial application.",
      "caveat": "The source concerns neural-network training. Do not generalize its dated architecture or optimizer advice into current best practice.",
      "status": "narrated",
      "dedup_review": "covered",
      "last_used": "2026-10-20",
      "last_narrated": "2026-10-20",
      "uses": [
        {
          "date": "2026-10-20",
          "channel": "podcast",
          "public_evidence_url": "https://github.com/pbhat89/the-brief/blob/main/podcast/reports/2026-10-20.sources.json",
          "confirmation": "Final delivered narration contains the source-backed input-inspection lesson; public evidence preserves source provenance only."
        }
      ]
    },
    {
      "concept_id": "tiny-case-pipeline-validation",
      "aliases": [
        "overfit one batch",
        "validate smallest working pipeline"
      ],
      "experts": [
        "Andrej Karpathy"
      ],
      "theme": "technical_coding",
      "title": "Prove the smallest pipeline works",
      "sources": [
        {
          "title": "A Recipe for Training Neural Networks",
          "url": "https://karpathy.github.io/2019/04/25/recipe/",
          "authors": [
            "Andrej Karpathy"
          ],
          "original_date": "2019-04-25",
          "original_date_basis": "Date displayed on original publisher page",
          "checked_on": "2026-10-23",
          "kind": "first_party",
          "verification": "direct_primary",
          "locator": "The recipe, section 2: overfit one batch and visualize just before the net"
        }
      ],
      "classification": "evergreen",
      "takeaway": "Karpathy suggests overfitting a tiny batch and inspecting the exact model inputs to expose pipeline bugs before scaling.",
      "editorial_application": "Create a small, known-answer test case before expanding an AI workflow. A passing demo still needs separate generalization checks.",
      "caveat": "A tiny training-set fit is a debugging check, not evidence of production quality. Keep this distinct from inspecting dataset quality.",
      "status": "narrated",
      "dedup_review": "covered",
      "last_used": "2026-10-23",
      "last_narrated": "2026-10-23",
      "uses": [
        {
          "date": "2026-10-23",
          "channel": "podcast",
          "public_evidence_url": "https://pbhat89.github.io/the-brief/podcast/reports/2026-10-23.html",
          "confirmation": "Final delivered narration includes the tiny-batch wiring-test lesson, separately distinguishing correct pipeline operation from generalization. Report provenance and accepted combined delivery were verified."
        }
      ]
    },
    {
      "concept_id": "build-ai-capability-through-pilots",
      "aliases": [
        "pilot team training strategy communication",
        "AI adoption capability sequence"
      ],
      "experts": [
        "Andrew Ng"
      ],
      "theme": "ai_transition",
      "title": "Build capability through pilots and training",
      "sources": [
        {
          "title": "Introducing the AI Transformation Playbook",
          "url": "https://medium.com/@andrewng/introducing-the-ai-transformation-playbook-58ccad4393e9",
          "authors": [
            "Andrew Ng"
          ],
          "original_date": "2018-12-13",
          "original_date_basis": "Date displayed on original publisher page",
          "checked_on": "2026-10-19",
          "kind": "first_party",
          "verification": "direct_primary",
          "locator": "Author introduction, five-step roadmap"
        }
      ],
      "classification": "evergreen",
      "takeaway": "Ng sequences AI transformation through pilot projects, an internal AI team, broad training, strategy, and communication, with sustained investment.",
      "editorial_application": "Choose a bounded pilot, then identify the team skills and communication needed to turn it into repeatable capability. This is an editorial application.",
      "caveat": "Do not select as unused: an earlier delivery-history record explicitly references the 2018 AI Transformation Playbook. Exact lesson-level reconciliation is pending, so this candidate is conservatively blocked from reuse. This does not newly assert a delivery date or narration state.",
      "status": "researched_candidate",
      "dedup_review": "pending_full_history",
      "last_used": null,
      "last_narrated": null,
      "uses": []
    },
    {
      "concept_id": "self-supervision-from-data-structure",
      "aliases": [
        "hidden input prediction",
        "learning supervisory signals from data"
      ],
      "experts": [
        "Yann LeCun"
      ],
      "theme": "technical_coding",
      "title": "Learn from the structure already in data",
      "sources": [
        {
          "title": "Self-supervised learning: The dark matter of intelligence",
          "url": "https://ai.meta.com/blog/self-supervised-learning-the-dark-matter-of-intelligence/",
          "authors": [
            "Yann LeCun",
            "Ishan Misra"
          ],
          "original_date": "2021-03-04",
          "original_date_basis": "Date displayed on original publisher page",
          "checked_on": "2026-10-21",
          "kind": "first_party",
          "verification": "direct_primary",
          "locator": "Self-supervised learning is predictive learning; author byline"
        }
      ],
      "classification": "evergreen",
      "takeaway": "LeCun and Misra describe self-supervision as learning to predict hidden aspects from observed data, reducing dependence on manually supplied labels.",
      "editorial_application": "When planning an AI project, distinguish the broad representations learned in pretraining from evidence needed to validate the actual task.",
      "caveat": "Coauthored research perspective from 2021. The authors present a promising research direction, not proof of human-level intelligence or label-free deployment.",
      "status": "narrated",
      "dedup_review": "covered",
      "last_used": "2026-10-21",
      "last_narrated": "2026-10-21",
      "uses": [
        {
          "date": "2026-10-21",
          "channel": "podcast",
          "public_evidence_url": "https://github.com/pbhat89/the-brief/blob/main/podcast/reports/2026-10-21.sources.json",
          "confirmation": "Final delivered narration contains the source-backed hidden-input-prediction lesson; public source audit establishes provenance, with delivery separately verified."
        }
      ]
    },
    {
      "concept_id": "specific-knowledge-through-curiosity",
      "aliases": [
        "domain judgment from experience",
        "build on distinctive expertise"
      ],
      "experts": [
        "Naval Ravikant"
      ],
      "theme": "ai_transition",
      "title": "Build on distinctive domain knowledge",
      "sources": [
        {
          "title": "Arm Yourself With Specific Knowledge",
          "url": "https://nav.al/specific-knowledge",
          "authors": [
            "Naval Ravikant",
            "Babak Nivi"
          ],
          "original_date": "2019-03-25",
          "original_date_basis": "Date displayed on original publisher page",
          "checked_on": "2026-10-24",
          "kind": "first_party",
          "verification": "direct_primary",
          "locator": "Original March 25 2019 discussion, sections Specific knowledge is found by pursuing your curiosity and Building specific knowledge will feel like play to you"
        }
      ],
      "classification": "evergreen",
      "takeaway": "Naval connects distinctive expertise to curiosity, experience and judgment in a domain, rather than simply pursuing whichever skill is fashionable.",
      "editorial_application": "Identify problems colleagues repeatedly bring to you and deepen one that genuinely interests you; explore AI for routine work around that distinctive strength. This is an editorial application.",